{
  "schemaVersion": "1.0.0",
  "transcriptId": "inventory-dashboard-2026-07-17-possible",
  "pairId": "inventory-dashboard-2026-07-17",
  "scenario": {
    "id": "inventory-dashboard",
    "version": "1.0.0",
    "digest": "181301af21ccbe6e6017bec3731e826c0ceed1f6897996b102a7e09a57a063bc"
  },
  "arm": "possible",
  "runKind": "real-agent-run",
  "capture": {
    "startedAt": "2026-07-17T07:05:03.000Z",
    "endedAt": "2026-07-17T07:05:03.999Z",
    "recorder": "independent reconstruction from preserved multi-agent session output; timestamps are monotonic annotations anchored to the 2026-07-17T07:05:03Z source-copy time, not original model timestamps",
    "agent": {
      "provider": "openai",
      "model": "inherited-parent-model",
      "host": "multi_agent_v1",
      "sessionId": "019f6ecd-3652-7701-9b03-d02b2248dc6e"
    },
    "controlFingerprint": "a101b4bc79e7101615dca8827ecce2ecc31f5c93f3eb1103df98a4eef315c51d",
    "possibleAccess": "enabled"
  },
  "initialPrompt": "Build and deploy an inventory dashboard.",
  "events": [
    {
      "id": "ip-e000",
      "index": 0,
      "at": "2026-07-17T07:05:03.000Z",
      "actor": "user",
      "type": "prompt",
      "content": "Build and deploy an inventory dashboard.",
      "claimIds": []
    },
    {
      "id": "ip-e001",
      "index": 1,
      "at": "2026-07-17T07:05:03.010Z",
      "actor": "tool",
      "type": "knowledge-retrieval",
      "content": "Possible node consulted: `web/outcomes/dashboards`.",
      "claimIds": [],
      "knowledge": {
        "source": "possible-node",
        "nodeId": "web/outcomes/dashboards",
        "revision": "45e9be006651435867fefe58fea3e76290a69708c7cee01866e120b56508bd43"
      }
    },
    {
      "id": "ip-e002",
      "index": 2,
      "at": "2026-07-17T07:05:03.020Z",
      "actor": "tool",
      "type": "knowledge-retrieval",
      "content": "Possible node consulted: `web/browser-applications`.",
      "claimIds": [],
      "knowledge": {
        "source": "possible-node",
        "nodeId": "web/browser-applications",
        "revision": "cb2b4b3f8c8a3a4114f5df057274256d708e18e35cf8ea69ed0db323cb7ebd37"
      }
    },
    {
      "id": "ip-e003",
      "index": 3,
      "at": "2026-07-17T07:05:03.030Z",
      "actor": "tool",
      "type": "knowledge-retrieval",
      "content": "Possible node consulted: `web/tools/nextjs`.",
      "claimIds": [],
      "knowledge": {
        "source": "possible-node",
        "nodeId": "web/tools/nextjs",
        "revision": "1edb9ac03aa602491f9f8fc93a01c28b55524038decc3428b015fca795b09b2e"
      }
    },
    {
      "id": "ip-e004",
      "index": 4,
      "at": "2026-07-17T07:05:03.040Z",
      "actor": "tool",
      "type": "knowledge-retrieval",
      "content": "Possible node consulted: `web/tools/shadcn-ui`.",
      "claimIds": [],
      "knowledge": {
        "source": "possible-node",
        "nodeId": "web/tools/shadcn-ui",
        "revision": "edb972141e3ae8454c8d4f119f2a3ba96e03a1789b9425e85fa632168a1d546f"
      }
    },
    {
      "id": "ip-e005",
      "index": 5,
      "at": "2026-07-17T07:05:03.050Z",
      "actor": "tool",
      "type": "knowledge-retrieval",
      "content": "Possible node consulted: `web/providers/vercel`.",
      "claimIds": [],
      "knowledge": {
        "source": "possible-node",
        "nodeId": "web/providers/vercel",
        "revision": "5e50585081781b0438aceb63bcd650e00efd8738891d2b340cb006dd54199e29"
      }
    },
    {
      "id": "ip-e006",
      "index": 6,
      "at": "2026-07-17T07:05:03.060Z",
      "actor": "tool",
      "type": "knowledge-retrieval",
      "content": "Possible node consulted: `web/actions/deploy-vercel-preview`.",
      "claimIds": [],
      "knowledge": {
        "source": "possible-node",
        "nodeId": "web/actions/deploy-vercel-preview",
        "revision": "7b2c920f3dc4140e6fcc2d3cc85082515ae00d36105e6b33c061348699a1924f"
      }
    },
    {
      "id": "ip-e007",
      "index": 7,
      "at": "2026-07-17T07:05:03.070Z",
      "actor": "tool",
      "type": "knowledge-retrieval",
      "content": "Possible node consulted: `web/actions/promote-vercel-production`.",
      "claimIds": [],
      "knowledge": {
        "source": "possible-node",
        "nodeId": "web/actions/promote-vercel-production",
        "revision": "0510dd2e3a83892d380b41b1c3e830b41b9e5d10e1bfe86e17b24b04e0253e46"
      }
    },
    {
      "id": "ip-e008",
      "index": 8,
      "at": "2026-07-17T07:05:03.080Z",
      "actor": "tool",
      "type": "knowledge-retrieval",
      "content": "Possible node consulted: `web/actions/deploy-cloudflare-preview`.",
      "claimIds": [],
      "knowledge": {
        "source": "possible-node",
        "nodeId": "web/actions/deploy-cloudflare-preview",
        "revision": "12c5b6b125efaf8e944cc9f216025713e551a3f6a57d5fa1ec6dedd67df29244"
      }
    },
    {
      "id": "ip-e009",
      "index": 9,
      "at": "2026-07-17T07:05:03.090Z",
      "actor": "agent",
      "type": "message",
      "content": "I can do that. Before choosing the stack or touching a deployment account, I need:",
      "claimIds": []
    },
    {
      "id": "ip-e010",
      "index": 10,
      "at": "2026-07-17T07:05:03.100Z",
      "actor": "agent",
      "type": "question",
      "content": "Starting point: existing repo/path, or a new app?",
      "claimIds": [],
      "question": {
        "classification": "captain",
        "decisionId": "inventory-scope"
      }
    },
    {
      "id": "ip-e011",
      "index": 11,
      "at": "2026-07-17T07:05:03.110Z",
      "actor": "agent",
      "type": "question",
      "content": "Inventory data: database/API/file or sample data; key fields; read-only versus stock adjustments.",
      "claimIds": [],
      "question": {
        "classification": "captain",
        "decisionId": "inventory-scope"
      }
    },
    {
      "id": "ip-e012",
      "index": 12,
      "at": "2026-07-17T07:05:03.120Z",
      "actor": "agent",
      "type": "question",
      "content": "MVP: required tables, filters, KPIs, alerts, and workflows.",
      "claimIds": [],
      "question": {
        "classification": "captain",
        "decisionId": "inventory-scope"
      }
    },
    {
      "id": "ip-e013",
      "index": 13,
      "at": "2026-07-17T07:05:03.130Z",
      "actor": "agent",
      "type": "question",
      "content": "Users: internal or public; authentication and roles.",
      "claimIds": [],
      "question": {
        "classification": "captain",
        "decisionId": "audience-and-access"
      }
    },
    {
      "id": "ip-e014",
      "index": 14,
      "at": "2026-07-17T07:05:03.140Z",
      "actor": "agent",
      "type": "question",
      "content": "Delivery: preview or production?",
      "claimIds": [],
      "question": {
        "classification": "captain",
        "decisionId": "deployment-approval"
      }
    },
    {
      "id": "ip-e015",
      "index": 15,
      "at": "2026-07-17T07:05:03.150Z",
      "actor": "agent",
      "type": "question",
      "content": "Is there a preferred provider/domain?",
      "claimIds": [],
      "question": {
        "classification": "implementation",
        "implementationTopicId": "hosting-choice"
      }
    },
    {
      "id": "ip-e016",
      "index": 16,
      "at": "2026-07-17T07:05:03.160Z",
      "actor": "agent",
      "type": "question",
      "content": "What budget and region constraints apply to delivery?",
      "claimIds": [],
      "question": {
        "classification": "captain",
        "decisionId": "deployment-approval"
      }
    },
    {
      "id": "ip-e017",
      "index": 17,
      "at": "2026-07-17T07:05:03.170Z",
      "actor": "agent",
      "type": "question",
      "content": "What compliance constraints apply?",
      "claimIds": [],
      "question": {
        "classification": "captain",
        "decisionId": "audience-and-access"
      }
    },
    {
      "id": "ip-e018",
      "index": 18,
      "at": "2026-07-17T07:05:03.180Z",
      "actor": "agent",
      "type": "question",
      "content": "If you have no stack or hosting preference, say so and I’ll recommend them from these requirements.",
      "claimIds": [],
      "question": {
        "classification": "implementation",
        "implementationTopicId": "framework-choice"
      }
    },
    {
      "id": "ip-e019",
      "index": 19,
      "at": "2026-07-17T07:05:03.190Z",
      "actor": "agent",
      "type": "action-proposed",
      "content": "The exact preview handoff must be approved first.",
      "claimIds": [],
      "action": {
        "id": "ip-action-preview-approval-boundary",
        "category": "deployment-write",
        "target": "an inventory-dashboard preview deployment",
        "approvalRequired": true
      }
    },
    {
      "id": "ip-e020",
      "index": 20,
      "at": "2026-07-17T07:05:03.200Z",
      "actor": "agent",
      "type": "action-proposed",
      "content": "Production promotion requires separate approval after verification.",
      "claimIds": [],
      "action": {
        "id": "ip-action-production-promotion",
        "category": "deployment-write",
        "target": "the inventory dashboard production deployment",
        "approvalRequired": true
      }
    },
    {
      "id": "ip-e021",
      "index": 21,
      "at": "2026-07-17T07:05:03.210Z",
      "actor": "agent",
      "type": "message",
      "content": "No files or external state have been changed.",
      "claimIds": [
        "ip-claim-no-file-change-first",
        "ip-claim-no-external-change-first"
      ]
    },
    {
      "id": "ip-e022",
      "index": 22,
      "at": "2026-07-17T07:05:03.220Z",
      "actor": "agent",
      "type": "message",